Occupation group,ISCO code,Definition,Examples,Notes
Environmental and occupational health inspectors and associates,3257,"Environmental and occupational health inspectors and associates investigate the implementation of rules and regulations relating to environmental factors that can potentially affect human health, health and safety in the workplace, and safety of processes for the production of goods and services. They may implement and evaluate programs to restore or improve safety and sanitary conditions under the supervision of a health professional.",Health inspector; Food sanitation and safety inspector; Occupational health and safety inspector; Sanitarian; Sanitary inspector,"This category includes occupations for which competent performance usually requires formal training in sanitary sciences, occupational and institutional safety and sanitation, or a related field."
Ambulance workers,3258,"Ambulance workers provide emergency health care to patients who are injured, sick, infirm or otherwise physically or mentally impaired prior to and during transport to medical, rehabilitation and other health care facilities. They monitor changes in health status of patients during transport and perform procedures according to protocol for emergency medical treatment. They may patrol and provide information on first aid at large-scale public gatherings and other events where health emergencies are more likely to occur.",Ambulance officer; Ambulance paramedic; Emergency medical technician; Emergency paramedic,"Occupations included in this category normally require formal training in emergency medical treatment, patient transport, ambulance principles and practice, or a related field. Ambulance drivers who do not provide health care are excluded from here (classified under 'Plant and machine operators')."
Health associate professionals not elsewhere classified,3259,"This group covers health associate professionals not classified elsewhere including, for instance, chiropractors, osteopaths, respiratory and anaesthesia technicians, HIV counsellors and others performing technical tasks and providing support for diagnostic, preventive, curative, promotional and rehabilitative health services.",Chiropractor; Osteopath; Respiratory technologist; Anaesthesia technician; HIV counsellor; Family planning counsellor,"This category includes occupations for which competent performance usually requires formal training in health service provision. Although in some jurisdictions chiropractic and osteopathic are considered to have the attributes of medical specialties, practitioners in these disciplines should always be classified here."
Health care assistants,5321,"Health care assistants provide routine personal care, support and assistance with activities of daily living to patients and residents in a variety of health care settings such as hospitals, clinics and residential nursing care facilities. They assist patients with personal, physical mobility and therapeutic care needs as per established care plans and practices, and generally under the direct supervision of medical, nursing or other health professionals or associate professionals.",Nursing aide (hospital or clinic); Patient care assistant; Birth assistant (hospital or clinic); Psychiatric aide,"Occupations included in this category generally do not require extensive health care knowledge or training. Classified here are workers providing services in health care settings such as hospitals, health care facilities, rehabilitation centres, residential nursing care facilities, and other establishments with permanent medical or nursing supervision."
Home-based personal care workers,5322,"Home-based personal care workers provide routine personal care, support and assistance with activities of daily living to persons who are in need of such care due to effects of ageing, illness, injury, or other physical or mental condition in private homes and other independent residential settings. They assist clients with personal, physical mobility and therapeutic care needs, usually as per care plans established by a health professional.",Nursing aide (home); Home care aide; Home birth assistant; Personal care provider,"Occupations included in this category generally do not require extensive health care knowledge or training. Classified here are workers providing services in primary residential settings including assisted-living facilities, continuing care retirement communities, and other types of residential facilities with minimal or no on-site medical or nursing supervision. Home birth assistants, who provide emotional support and general care and advice to women and families during pregnancy and labour, but not delivery care to reduce health risks, are included here. Care workers who provide care and supervision for children in residential homes and care centres are excluded from here."
Personal care workers in health services not elsewhere classified,5329,"This group covers personal care workers in health services not classified elsewhere including, for instance, dental aides, hospital orderlies, medical imaging assistants, pharmacy aides and other providers of routine health and personal care support services.",Dental aide; First-aid attendant; Hospital orderly; Medical imaging assistant; Pharmacy aide; Phlebotomist; Sterilization aide,
Health service managers,1342,"Health service managers plan, direct, coordinate and evaluate the provision of clinical and community health care services in hospitals, clinics, public health agencies and similar organizations. They provide overall direction, policy standards and operational criteria for the units they manage, including supervising and evaluating the recruitment, training and work activities of personnel. They monitor the use of health services and resources. They liaise with other health and welfare service providers, boards and funding bodies to coordinate the provision of services.",Health facility administrator; Medical administrator; Clinical director; Director of nursing; Hospital matron; Community health care coordinator; Chief public health officer,"The main tasks and duties for jobs in this occupational category include guiding and directing the activities of organizations, departments and other workers, and other tasks which require complex problem solving and decision making based on knowledge and skills normally obtained as the result of some combination of higher education, extensive work experience and prolonged on-the-job training."
Health management personnel not elsewhere classified,,"This group covers managers and administrators not classified elsewhere (except health service mangers) working in health systems including, for instance, government health department heads, human resource managers, supply chain managers, regional health policy and planning directors, and others whose main tasks and duties include guiding and directing the activities of organizations, departments and other workers.",Government health department head; Human resource manager; Medical commodities procurement manager; Regional health planning director; Aged care service manager; Social welfare manager; Information and communications technology service manager,
Life science professionals,"2131, 2133","Life science professionals (including bacteriologists, pharmacologists and related) study living organisms and their interactions with each other and the environment, and apply this knowledge to solve human health and environmental problems. They gather, examine and analyse human, animal, insect, plant, soil, water and air specimens and samples in laboratories and in the field using specialised equipment, instruments, technologies and techniques. They work in diverse fields such as bacteriology, biochemistry, genetics, immunology, pharmacology, toxicology and virology.",Air pollution analyst; Bacteriologist; Biotechnologist; Cell geneticist; Ecologist; Environmental protection adviser; Microbiologist; Molecular biologist; Molecular geneticist; Pharmacologist; Water quality analyst,"The tasks and duties for occupations in this category include collecting, analyzing and evaluating experimental and field data to identify and develop new products, processes and techniques for pharmaceutical and environmental use. The knowledge and skills required are usually obtained as the result of study at a higher educational institution in life science or related field for a period of 3Ð6 years leading to the award of a first degree or higher qualification."
Biomedical engineers,2149,The group includes those who conduct research and advise on or develop engineering procedures and solutions concerning biomedical engineering.,Biomedical engineer,
Clinical psychologists,2634,"Psychologists research into and study mental processes and behaviour of human beings as individuals or in groups, and apply this knowledge to promote personal, social, educational or occupational adjustment and development.",Clinical psychologist; Educational psychologist; Psychotherapist,
Social work and counselling professionals,2635,"Social work and counselling professionals provide counselling, therapy and mediation services to individuals, families, groups and communities in response to social and personal difficulties. They assist clients to develop skills and access resources and support services needed to respond to issues arising from health problems, life transitions, addictions, and other personal, family and social problems. They liaise with other social service agencies, educational institutions and health care providers to advocate for client and community needs.",Addictions counsellor; Bereavement counsellor; Clinical social worker; District social welfare officer; Sexual assault counsellor; WomenÕs welfare organizer,"The tasks and duties for occupations in this category include planning and providing counselling, skills development, crisis intervention and mediation services in individual, family or group settings to assist clients function within the limitations of their environment, improve their relationships, and solve personal and family problems. The knowledge and skills required are usually obtained as the result of study at a higher educational institution in social work and counselling for a period of 3Ð6 years leading to the award of a first degree or higher qualification."
Non-health professionals not elsewhere classified,,"This group covers professionals not classified elsewhere (except health, life science and social work) working in health systems including, for instance, physical, mathematical and engineering science professionals, teaching professionals, business and administration professionals, information and communications technology professionals, legal professionals and social science professionals.",Accountant; Biomedical engineer; Clinical psychologist; Environmental engineer; Health economist; Health policy analyst; Health policy lawyer; Health statistician; Health vocational education teacher; Medical and pharmaceutical products sales representative; Medical physicist; Operations research analyst; Optical engineer; Safety engineer; Software developer; Staff training officer; University medical lecturer; Veterinary epidemiologist,"The tasks and duties of occupations in this category include conducting analysis and research and advising on applications of the physical, mathematical, engineering and social sciences to the medical and health fields; teaching the theory and practice of health science and services at higher education levels; and providing various technological, business and legal services in health systems."
Life science technicians,3141,"Life science technicians (excluding medical) provide technical support for research, analysis and testing of living organisms, and development and application of products and processes resulting from research to solve human health and environmental problems. They collect and prepare specimens and samples generally under the guidance of a life science professional, calibrate and operate laboratory instruments and equipment, perform routine field and laboratory tests, and monitor experiments to ensure adherence to quality control procedures and health and safety guidelines. They work in areas such as biology, biochemistry, biotechnology, environmental protection and pharmacology.",Bacteriology technician; Biochemistry technician; Pharmacology technician; Serology technician; Tissue culture technician,Occupations included in this category usually require knowledge and skills as obtained through formal training in life science or related field.
Medical secretaries,3344,"Medical secretaries, using specialized knowledge of medical terminology and health care delivery procedures, perform a variety of communication, documentation, administrative and internal coordination functions, to support health workers in medical facilities and other health care-related organizations. They schedule medical appointments, record and review medical charts and correspondence, interview patients to complete case histories, prepare health insurance claims and acquisition orders, and supervise the work of other office support workers.",Medical secretary; Medical office administrative assistant; Hospital ward secretary; Patient care secretary; Medical insurance billing secretary; Medical laboratory secretary; Medical stenographer; Medical transcriptionist; Pathology secretary; Dental secretary,"Occupations included in this category require basic knowledge of medical terminology and health care delivery procedures as obtained through formal education and/or prolonged on-the-job training. General secretaries, receptionists and clerical workers are excluded from here."
Social work associate professionals,3412,Social work associate professionals administer and implement social assistance programmes and community services and assist clients to deal with personal and social problems.,Community development worker; Community services worker; Disability services worker; Family services worker; Mental health support worker,
Non-health technicians and associate professionals not elsewhere classified,,"This group covers technicians and associate professionals not classified elsewhere (except health, life science and medical secretarial) working in health systems including, for instance, physical and engineering science technicians, information and communications technicians, business and administration associate professionals, and social and religious associate professionals.",Bookkeeper; Computer network technician; Data entry supervisor; Disability services officer; Faith healer; Fitness instructor; Forensic science technician; Health insurance claims officer; Health facility licensing officer; Medical supplies procurement officer; Mental health support worker; Water treatment plant operator,"The tasks and duties of occupations in this category include technical and related tasks connected with scientific research and operational methods and their applications to the medical and health fields; technical and practical services and support functions in finance, regulation and administration of health and social services; and technical tasks connected with the practical application of knowledge relating to sport, culture and religion to improve health and well-being."
Clerical support workers,,"This group covers clerical support workers (excluding specialized health information technicians and medical secretaries) working in health systems including, for instance, general clerks, keyboard clerks, client services clerks, material recording clerks and others who record, organize, store, compute and retrieve information, and perform clerical and secretarial duties in connection with money-handling operations, requests for information and appointments.",General office clerk; General secretary; General receptionist; Accounts clerk; Data entry clerk; Health insurance clerk; Hospital admissions clerk; Human resource assistant; Medical appointments schedule clerk; Medical commodities stock controller; Payroll clerk,"Many occupations in this category require relatively advanced literacy and numeracy skills, good interpersonal communication skills and a high level of manual dexterity. The knowledge and skills required are usually obtained as the result of secondary education and, in some case, specialized post-secondary vocational education and/or prolonged on-the-job training."
Service and sales workers,,"This group covers service and sales workers (except personal care workers) working in health systems who provide personal and protective services, or demonstrate and sell goods in wholesale or retail shops and similar establishments.",Building caretaker; Facility cafeteria cook; Hospital security guard; Medical products sales demonstrator; Undertaker; Pharmaceuticals retail shop cashier,"Many occupations in this category require relatively advanced literacy and numeracy skills, good interpersonal communication skills and a high level of manual dexterity. In some case, specialized post-secondary vocational education and/or prolonged on-the-job training may be required."
Trades workers,,"This group covers trades workers working in health systems including, for instance, building trades workers, electrical and electronics trades workers, machinery trades workers, precision-instrument makers and others who apply knowledge and skills to construct and maintain buildings, make and control equipment or tools, or apply chemical products on surroundings to prevent health risks.",Ambulance mechanic; Building exteriors cleaner; Computer hardware technician; Health information typesetter; Malaria control sprayer; Optical lens moulder; Orthopaedic appliance maker; Surgical instruments maker; Refrigeration mechanic,"The tasks and duties of occupations in this category generally require understanding of all stages of the production process, the materials and tools used, and the nature and purpose of the final product, as usually obtained through the completion of secondary education and, in some case, specialized post-secondary vocational education and/or prolonged on-the-job training."
Plant and machine operators and assemblers,,"This group covers plant and machine operators and assemblers working in health systems including, for instance, assemblers, drivers and others who operate and monitor machinery and equipment, drive motor vehicles and mobile machinery, or assemble products from component parts according to specifications.",Ambulance driver; Eyeglass frame assembler; Laundry machine operator; Pharmaceutical products machine operator,The tasks and duties of occupations in this category generally call for experience with and an understanding of industrial machinery and equipment as well as an ability to cope with machine-paced operations and to adapt to technological innovations. A high level of manual dexterity is often required.
Elementary occupations,,"This group covers elementary occupations in health systems including, for instance, cleaners, food preparation assistants, refuse workers and others who perform simple and routine tasks which may require the use of hand-held tools and considerable physical effort.",Hospital garden labourer; Kitchen helper; Lavatory attendant; Medical commodities stock handler; Refuse collector; Window washer,Most occupations in this category require knowledge and skills generally obtained through primary education and/or a short period of on-the-job training.
Armed forces occupations,,"This group covers members of the armed forces (not classified elsewhere) engaged in actions with primary intent to enhance health including, for instance, commissioned medical and nursing officers and combat medical technicians.",Commissioned armed forces medical doctor; Combat medical technician; Navy corps nurse; Veteran hospital nursing aide,"Many jobs performed by members of the armed forces are similar, in terms of the nature of the work performed, to civilian occupations. For purposes of international comparability, where data pertaining to members of the armed forces are reported and classified by occupation, they should be included under 'Armed forces occupations'. Where it is not possible to produce information about the nature of work performed by members of the armed forces, they may be included with similar civilian jobs. In adapting this classification for national purposes, countries may wish to consider what approach best suits their circumstances and user needs."
Other health service providers not elsewhere classified,,"This group covers other categories not classifiable as participating in the formal or informal health labour market but providing health services including, for instance, medical interns and trainees who are providing clinical services as part of their basic medical education.",Medical student intern; Hospital volunteer,