Occupation group,ISCO code,Definition,Examples,Notes
Generalist medical practitioners,2211,"Generalist medical doctors (including family and primary care doctors) diagnose, treat and prevent illness, disease, injury, and other physical and mental impairments and maintain general health in humans through application of the principles and procedures of modern medicine. They plan, supervise and evaluate the implementation of care and treatment plans by other health care providers. They do not limit their practice to certain disease categories or methods of treatment, and may assume responsibility for the provision of continuing and comprehensive medical care to individuals, families and communities.",Medical doctor (general); Medical officer (general); Physician (general); General practitioner; Family medical practitioner; Primary health care physician; District medical doctor; Resident medical officer specializing in general practice; Township medical officer; Station medical officer; Specialist in family medicine; Medical officer,"Occupations included in this category require completion of a university-level degree in basic medical education plus postgraduate clinical training or equivalent. Medical interns who have completed their university education in basic medical education and are undertaking postgraduate clinical training are included here. Although in some countries â€˜general practiceâ€™ and 'family medicine' may be considered as medical specializations, these occupations should always be classified here."
Specialist medical practitioners,2212,"Specialist medical doctors diagnose, treat and prevent illness, disease, injury and other physical and mental impairments using specialized testing, diagnostic, medical, surgical, physical and psychiatric techniques, through application of the principles and procedures of modern medicine. They plan, supervise and evaluate the implementation of care and treatment plans by other health care providers. They specialize in certain disease categories, types of patient or methods of treatment, and may conduct medical education and research activities in their chosen areas of specialization.",Specialist physician (internal medicine); Surgeon; Anaesthetist; Cardiologist; Emergency medicine specialist; Ophthalmologist; Gynaecologist; Obstetrician; Paediatrician; Pathologist; Preventive medicine specialist; Psychiatrist; Radiologist; Resident medical officer in specialist training,"Occupations included in this category require completion of a university-level degree in basic medical education plus postgraduate clinical training in a medical specialization (except general practice) or equivalent. Resident medical officers training as specialist practitioners (except general practice) are included here. Although in some countries 'stomatology' may be considered as a medical specialization, stomatologists should be included under 'Dentists'-2261. Medical research professionals who participate in biomedical research using living organisms and do not undertake clinical practice should be excluded from here (classified under 'Life science professionals')."
Nursing professionals,2221,"Nursing professionals provide treatment, support and care services for people who are in need of nursing care due to the effects of ageing, injury, illness or other physical or mental impairment, or potential risks to health, according to the practice and standards of modern nursing. They assume responsibility for the planning and management of the care of patients, including the supervision of other health care workers, working autonomously or in teams with medical doctors and others in the practical application of preventive and curative measures in clinical and community settings.",Professional nurse; Specialist nurse; Nurse practitioner; Clinical nurse; District nurse; Operating theatre nurse; Public health nurse; Nurse anaesthetist; Nurse educator; Township health Nurse; Public health nursing sister,"This category includes occupations for which competent performance usually requires formal training at a higher educational institution in nursing. The distinction between nursing and midwifery professionals and associate professionals should be made on the basis of the nature of the work performed in relation to this definition. The qualifications held by individuals or that predominate in the country are not the main factor in making this distinction, as training arrangements for nurses and midwives vary widely between countries and have varied over time within countries."
Midwifery professionals,2222,"Midwifery professionals plan, manage, provide and evaluate midwifery care services before, during and after pregnancy and childbirth. They provide delivery care for reducing health risks to women and newborn children according to the practice and standards of modern midwifery, working autonomously or in teams with other health care providers. They may conduct research on midwifery practices and procedures, and implement midwifery education activities in clinical and community settings.",Professional midwife; Public health midwife,"This category includes occupations for which competent performance usually requires formal training at a higher educational institution in midwifery. The distinctions between nursing and midwifery professionals and associate professionals should be made on the basis of the nature of the work performed in relation to this definition. The qualifications held by individuals or that predominate in the country are not the main factor in making this distinction, as training arrangements for nurses and midwives vary widely between countries and have varied over time within countries."
Traditional and complementary medicine professionals,2230,"Traditional and complementary medicine professionals examine patients and prevent and treat illness, disease, injury and other physical, mental and psychosocial ailments by applying knowledge, skills and practices acquired through extensive study of the theories and experiences originating in specific cultures. They research, develop and implement treatment plans using applications such as acupuncture, ayurvedic, homoeopathic and herbal medicine.",Acupuncturist; Ayurvedic practitioner; Chinese herbal medicine practitioner; Homeopath; Naturopath; Unani practitioner; Drungtsho,"This category includes occupations for which competent performance requires an extensive understanding of the benefits and applications of traditional and complementary therapies, developed as the result of extended formal study of these techniques as well as human anatomy and elements of modern medicine. Practitioners working in the singular application of approaches to herbal medicines, spiritual therapies or manual therapeutic activity are excluded from here."
Paramedical practitioners,2240,"Paramedical practitioners (including clinical officers and related) provide advisory, diagnostic, curative and preventive medical services more limited in scope and complexity than those carried out by medical doctors. They work autonomously or with limited supervision of medical doctors, and perform clinical, therapeutic and surgical procedures for treating and preventing diseases, injuries, and other physical or mental impairments common to specific communities.",Clinical officer; Primary care paramedic; Advanced care paramedic; Surgical technician; Feldsher,Occupations included in this category normally require completion of tertiary-level training in theoretical and practical medical services. Workers providing services limited to emergency treatment and ambulance practice are classified under 'Ambulance workers'-3258.
Dentists,2261,"Dentists (including dental surgeons and related) diagnose, treat and prevent diseases, injuries and abnormalities of the teeth, mouth, jaws and associated tissues by applying the principles and procedures of modern dentistry. They use a broad range of specialized diagnostic, surgical and other techniques to promote and restore oral health.",Dentist; Dental practitioner; Dental surgeon; Endodontist; Oral and maxillofacial surgeon; Oral pathologist; Orthodontist; Paedodontist; Periodontist; Prosthodontist; Stomatologist,"Occupations included in this category normally require completion of university-level training in theoretical and practical dentistry or a related field. Although in some countries ÔstomatologyÕ and 'dental, oral and maxillofacial surgery' may be considered as medical specializations, occupations in these fields should always be classified here."
Pharmacists,2262,"Pharmacists store, preserve, compound and dispense medicinal products. They counsel on the proper use and adverse effects of drugs and medicines following prescriptions issued by medical doctors and other health professionals. They contribute to researching, testing, preparing, prescribing and monitoring medicinal therapies for optimizing human health.",Hospital pharmacist; Industrial pharmacist; Retail pharmacist; Dispensing chemist,"Occupations included in this category normally require completion of university-level training in theoretical and practical pharmacy, pharmaceutical chemistry or a related field. Pharmacologists and related professionals who study living organisms are excluded from here (classified under 'Life science professionals')."
Environmental and occupational health and hygiene professionals,2263,"Environmental and occupational health and hygiene professionals assess, plan and implement programs to recognize, monitor and control environmental factors that can potentially affect human health, to ensure safe and healthy working conditions, and to prevent disease or injury caused by chemical, physical, radiological and biological agents or ergonomic factors.",Environmental health officer; Occupational health and safety adviser; Occupational hygienist; Radiation protection adviser,"This category includes occupations for which competent performance usually requires formal training at a higher educational institution in environmental or occupational health and safety, or a related field. Professionals who assess, plan and implement programmes to monitor or control the impact of human activities on the environment are excluded from here (classified under 'Life science professionals')."
Physiotherapists,2264,"Physiotherapists assess, plan and implement rehabilitative programs that improve or restore human motor functions, maximize movement ability, relieve pain syndromes, and treat or prevent physical challenges associated with injuries, diseases and other impairments. They apply a broad range of physical therapies and techniques such as movement, ultrasound, heating, laser and other techniques. They may develop and implement programmes for screening and prevention of common physical ailments and disorders.",Physiotherapist; Geriatric physical therapist; Orthopaedic physical therapist; Paediatric physical therapist,This category includes occupations for which competent performance usually requires formal training at a higher educational institution in physiotherapy or a related field.
Dieticians and nutritionists,2265,"Dieticians and nutritionists assess, plan and implement programs to enhance the impact of food and nutrition on human health. They may conduct research, assessments and education to improve nutritional levels among individuals and communities.",Dietician; Clinical dietician; Food service dietician; Nutritionist; Public health nutritionist; Sports nutritionist,"This category includes occupations for which competent performance usually requires formal training at a higher educational institution in food and nutritional science, nutrition education, dietetics, or a related field."
Audiologists and speech therapists,2266,"Audiologists and speech therapists evaluate, manage and treat physical disorders affecting human hearing, speech communication and swallowing. They prescribe corrective devices or rehabilitative therapies for hearing loss, speech disorders, and related sensory and neural problems. They plan hearing screening programs and provide counselling on hearing safety and communication performance.",Audiologist; Speech therapist; Speech pathologist; Language therapist,"This category includes occupations for which competent performance usually requires formal training at a higher educational institution in audiology, speech pathology, clinical language sciences or a related field."
Optometrists and opthalmic opticians,2267,"Optometrists and ophthalmic opticians provide diagnosis, management and treatment services for disorders of the eyes and visual system. They counsel and advise on eye care and safety, and prescribe optical aids or other therapies for visual disturbance.",Optometrist; Ophthalmic optician; Orthoptist,"This category includes occupations for which competent performance usually requires formal training at a higher educational institution in optometry, orthoptics or a related field."
Health professionals not elsewhere classified,2269,"This group covers health professionals not classified elsewhere such as podiatrists, occupational therapists, recreational therapists and other professionals providing diagnostic, preventive, curative and rehabilitative health services.",Podiatrist; Occupational therapist; Recreational therapist; Arts therapist; Dance and movement therapist,
Medical imaging and therapeutic equipment technicians,3211,"Medical imaging and therapeutic equipment technicians test and operate radiographic, ultrasound and other medical imaging equipment to produce images of body structures for the diagnosis and treatment of injury, disease and other impairments. They may administer radiation treatments and monitor patients' conditions under the supervision of a radiologist or other health professional.",Diagnostic medical radiographer; Medical radiation therapist; Magnetic resonance imaging technologist; Nuclear medicine technologist; Mammographer; Sonographer,"This category includes occupations for which competent performance usually requires formal training in medical technology, radiology, sonography, nuclear medical technology or a related field."
Medical and pathology laboratory technicians,3212,"Medical and pathology laboratory technicians perform clinical tests on specimens of bodily fluids and tissues in order to get information about the health of a patient or cause of death. They test and operate equipment such as spectrophotometers, calorimeters and flame photometers for analysis of biological material including blood, urine and spinal fluid.",Medical laboratory technician; Medical laboratory assistant; Blood bank technician; Cytology technician; Pathology technician,"This category includes occupations for which competent performance usually requires formal training in biomedical science, medical technology or a related field. Technicians who conduct laboratory tests on living organisms should be classified under 'Life science technicians'. Forensic science technicians, who perform clinical tests to aid in the investigation of crimes, should be classified under 'Physical and engineering science technicians'."
Pharmaceutical technicians and assistants,3213,"Pharmaceutical technicians and assistants perform a variety of tasks associated with dispensing medicinal products under the guidance of a pharmacist or other health professional. They inventory, prepare and store medications and other pharmaceutical compounds and supplies, and may dispense medicines and drugs to clients and instruct on their use as prescribed by health professionals.",Pharmaceutical technician; Pharmaceutical assistant; Dispensing technician,Occupations included in this category normally require knowledge and skills in pharmaceutical services as obtained through formal training. Pharmacology technicians and related associate professionals who work with living organisms are excluded from here (classified under 'Life science technicians').
Medical and dental prosthetic technicians,3214,"Medical and dental prosthetic technicians design, fit, service and repair medical and dental devices and appliances following prescriptions or instructions established by a health professional. They may service a wide range of support instruments to correct physical medical or dental problems such as neck braces, orthopaedic splints, artificial limbs, hearing aides, arch supports, dentures, and dental crowns and bridges.",Medical appliance technician; Orthotist; Orthotic technician; Prosthetist; Prosthetic technician; Denturist; Dental technician,"Occupations included in this category normally require some medical, dental and anatomical knowledge obtained through formal training. Technicians who construct and repair precision medical and surgical instruments are excluded from here (classified under 'Trades workers')."
Nursing associate professionals,3221,"Nursing associate professionals provide basic nursing and personal care for people in need of such care due to effects of ageing, illness, injury, or other physical or mental impairment. They provide health advice to patients and families; monitor patients' conditions; and implement care, treatment and referral plans usually established by medical, nursing and other health professionals.",Assistant nurse; Enrolled nurse; Practical nurse,"This category includes occupations for which competent performance usually requires knowledge and skills obtained as the result of study in nursing; in some cases, extensive on-the-job training may substitute for the formal education formal. The criteria for inclusion of individuals in this category should be made on the basis of the nature of the work performed in relation to this definition, and not the qualifications held by individuals or that predominate in the country."
Midwifery associate professionals,3222,"Midwifery associate professionals provide basic health care and advice before, during and after pregnancy and childbirth. They provide advice to women, families and communities on birth and emergency plans, breastfeeding, infant care, family planning and related topics; monitor health status during pregnancy and childbirth; and implement care, treatment and referral plans usually established by medical, midwifery and other health professionals.",Assistant midwife; Auxiliary midwife; Traditional midwife,"This category includes occupations for which competent performance requires knowledge and skills in routine and emergency midwifery care acquired through formal or informal training. The criteria for inclusion of individuals in this category should be made on the basis of the nature of the work performed in relation to this definition, and not the qualifications held by individuals or that predominate in the country. Traditional and lay midwives, who provide basic pregnancy and birthing care and advice based primarily on experience and knowledge acquired informally through the traditions and practices of the communities where they originated, are included here. Birth assistants, who provide emotional support and general care and advice to women and families during pregnancy and labour, are excluded from here (classified under 'Personal care workers in health services')."
Traditional and complementary medicine associate professionals,3230,"Traditional and complementary medicine associate professionals prevent, care for and treat physical and mental illnesses, disorders and injuries using herbal and other therapies based on theories and experiences originating in specific cultures. They administer treatments using traditional techniques and medicaments, either acting independently or according to therapeutic care plans established by a traditional medicine or other health professional.",Acupuncture technician; Ayurvedic technician; Bonesetter; Herbalist; Homeopathy technician; Scraping and cupping therapist; Village healer; sMenpas,"This category includes occupations for which competent performance requires knowledge and skills acquired through relatively short periods of education and training, or informally through the traditions and practices of the communities where they originated. Faith healers, who treat human ailments through spiritual therapies, without using herbal therapies or other medicaments or physical treatments, are excluded from here (classified under 'Religious associate professionals'). Occupations that provide therapy using traditional forms of massage and the application of pressure, such as acupressure and shiatsu therapists, are classified under 'Physiotherapy technicians and assistants'-3255."
Dental assistants and therapists,3251,"Dental assistants and therapists provide basic dental care services for the prevention and treatment of diseases and disorders of the teeth and mouth, as per care plans and procedures established by a dentist or other oral health professional. They examine patients' mouths, teeth and related structures to assess oral health status; provide advice on dental hygiene; perform basic or routine clinical dental procedures; and assisting dentists during complex dental procedures.",Dental assistant; Dental hygienist; Dental therapist,"This category includes occupations for which competent performance usually requires formal training in dental hygiene, dental-assisting or a related field."
Medical records and health information technicians,3252,"Medical records and health information technicians develop, implement and assess health records processing, storage and retrieval systems in medical facilities and other health care settings to meet the legal, professional, ethical and administrative records-keeping requirements of health services delivery.",Medical records technician; Health information clerk; Medical records analyst; Medical records unit supervisor; Clinical coder; Disease registry technician,"Occupations included in this category require knowledge of medical terminology, legal aspects of health information, health data standards, and computer- or paper-based data management as obtained through formal education and/or prolonged on-the-job training. General secretarial or clerical workers are excluded from here."
Community health workers,3253,"Community health workers provide health education, referral and follow up, case management, and basic preventive health care and home visiting services to specific communities. They provide support and assistance to individuals and families in navigating the health and social services system.",Community health worker; Community health aide; Community health promoter; Village health worker; Kaders (community volunteer),Occupations included in this category normally require formal or informal training and supervision recognized by the health and social services authorities. Providers of routine personal care services and traditional medicine practitioners are not included here.
Dispensing opticians,3254,"Dispensing opticians design, fit and dispense optical lenses based on a prescription from an ophthalmologist or optometrist for the correction of reduced visual acuity. They service corrective eyeglasses, contact lenses, low-vision aids and other optical devices.",Dispensing optician; Contact lens optician,This category includes occupations for which competent performance usually requires formal training in opticianry.
Physiotherapy technicians and assistants,3255,"Physiotherapy technicians and assistants provide physical therapeutic treatments to patients in circumstances where functional movement is threatened by injury, disease or impairment. They fit patients for physical supportive devices and administer and monitor manual treatments, electrical modality treatments, ultrasound and other physical therapies. Therapies are usually provided as per rehabilitative plans established by a physiotherapist or other health professional.",Physiotherapy technician; Physical rehabilitation technician; Acupressure therapist; Electrotherapist; Hydrotherapist; Massage therapist; Shiatsu therapist,"This category includes occupations for which competent performance usually requires formal training in physical rehabilitation therapy or a related field. Fitness instructors, who teach body movements used in fitness routines and recreational activities, are excluded from here (classified under 'Social, cultural and related associate professionals')."
Medical assistants,3256,"Medical assistants perform basic clinical and administrative tasks to support patient care under the direct supervision of a medical practitioner or other health professional. They perform routine tasks and procedures such as measuring patients' vital signs, administering medications and injections, recording information in medical records-keeping systems, preparing and handling medical instruments and supplies, and collecting and preparing specimens of bodily fluids and tissues for laboratory testing.",Medical assistant; Clinical assistant; Ophthalmic assistant; Health assistant,This category includes occupations for which competent performance normally requires formal training in health services provision. Clinical care providers with advanced training and skills to provide independent medical diagnostic and treatment services should be classified under 'Paramedical practitioners'-2240.
